id,nombre,ciudadDestino,usuario,fechaInicio,fechaFin,descripcion
1,Malesuada Ltd,Dadu,54,18/06/2020,22/11/2020,Aenean eget magna. Suspendisse tristique neque venenatis lacus. Etiam bibendum
2,Donec Sollicitudin Adipiscing Incorporated,South Portland,74,22/07/2020,16/09/2021,"vulputate, posuere vulputate, lacus. Cras interdum. Nunc sollicitudin commodo ipsum."
3,Sed Dictum Corp.,Bischofshofen,16,06/01/2020,05/12/2020,"elit, a feugiat tellus lorem eu"
4,Bibendum Incorporated,Diets-Heur,79,27/09/2020,30/03/2021,aliquet. Phasellus fermentum convallis ligula. Donec luctus aliquet odio. Etiam
5,Vestibulum Accumsan LLC,Forfar,92,04/09/2020,25/11/2020,"enim. Suspendisse aliquet, sem ut cursus"
6,Mus Donec Dignissim Institute,Okotoks,11,15/01/2020,06/11/2021,Duis volutpat nunc sit amet metus. Aliquam erat volutpat. Nulla
7,Orci Consulting,Raipur,34,27/11/2019,12/03/2021,"laoreet lectus quis massa. Mauris vestibulum,"
8,Iaculis Industries,Balen,46,08/03/2020,12/11/2021,congue. In scelerisque scelerisque
9,Faucibus Id Industries,Gateshead,14,14/02/2020,09/11/2021,"ac, feugiat non, lobortis quis, pede."
10,Nunc Sed Incorporated,Guardia Sanframondi,1,20/12/2019,21/04/2021,nisl. Maecenas malesuada fringilla est. Mauris
11,Faucibus Orci Luctus Institute,Kelso,9,11/06/2020,13/02/2021,"amet, risus. Donec nibh"
12,Porttitor Interdum Sed LLP,Bad Kreuznach,26,08/04/2020,11/07/2021,"magna. Nam ligula elit, pretium et, rutrum non, hendrerit"
13,Magna A Consulting,Hualqui,88,02/06/2020,02/04/2021,"accumsan convallis, ante lectus convallis est,"
14,Elit Erat LLC,Helmsdale,12,14/07/2020,06/04/2021,morbi tristique senectus et netus et malesuada fames
15,Scelerisque Sed Industries,Borsbeek,19,30/01/2020,19/03/2021,vitae diam. Proin dolor. Nulla
16,Amet Ante Institute,Coatbridge,65,24/11/2019,10/06/2021,"leo. Morbi neque tellus, imperdiet non, vestibulum nec, euismod"
17,Molestie Orci LLC,Mastung,27,11/01/2020,06/01/2021,imperdiet ornare. In faucibus. Morbi vehicula. Pellentesque tincidunt tempus risus.
18,Ultrices Vivamus Rhoncus LLC,Gibsons,84,23/06/2020,11/07/2021,"imperdiet nec, leo. Morbi neque tellus, imperdiet"
19,Enim Associates,Hattem,96,08/12/2019,07/08/2021,"velit. Cras lorem lorem, luctus ut,"
20,Non Leo Vivamus Incorporated,Fortune,17,02/06/2020,18/11/2021,interdum feugiat. Sed nec metus facilisis lorem
21,Vivamus Nibh Dolor Associates,Great Yarmouth,52,30/12/2019,13/01/2021,Cras sed leo. Cras vehicula
22,Consequat Auctor Ltd,Wernigerode,72,05/10/2020,26/02/2021,"vel est tempor bibendum. Donec felis orci, adipiscing non, luctus"
23,Et Inc.,Binjai,50,27/07/2020,28/01/2021,Nunc ac sem ut dolor dapibus gravida.
24,Duis PC,Champigny-sur-Marne,12,05/01/2020,13/11/2021,eu erat semper
25,Consequat Auctor Limited,Gdynia,95,09/08/2020,03/06/2021,"parturient montes, nascetur ridiculus mus. Aenean eget"
26,Vivamus Rhoncus Consulting,Belo Horizonte,76,18/08/2020,03/08/2021,a
27,Non Nisi Aenean PC,Chełm,92,01/05/2020,28/02/2021,"egestas, urna justo faucibus lectus, a sollicitudin orci sem"
28,Quisque Tincidunt Pede Associates,Sint-Michiels,20,13/08/2020,25/07/2021,"auctor non, feugiat"
29,Nunc In Corporation,HomprŽ,33,03/03/2020,12/01/2021,euismod est arcu ac orci. Ut
30,Class Industries,Suwałki,47,30/04/2020,17/07/2021,Etiam bibendum fermentum metus.
31,Lorem Luctus Ut Corporation,Paine,64,17/04/2020,14/04/2021,neque. Morbi quis
32,Mauris Eu LLP,Novodvinsk,57,23/03/2020,09/10/2021,"In mi pede, nonummy ut, molestie in, tempus"
33,Ultricies Ornare Elit Foundation,Diadema,7,14/08/2020,05/10/2021,eu tellus eu augue porttitor interdum.
34,Phasellus Ornare Fusce Company,Ferrandina,61,18/01/2020,06/09/2021,amet ornare lectus justo eu arcu.
35,Lobortis LLP,Granada,38,21/09/2020,04/06/2021,"ad litora torquent per conubia nostra, per inceptos hymenaeos. Mauris"
36,Ipsum Dolor Corporation,Kaster,79,12/12/2019,11/03/2021,natoque
37,Eu Ltd,Purranque,74,15/12/2019,21/01/2021,"ligula tortor, dictum eu,"
38,Mus Aenean LLC,Máfil,63,21/01/2020,20/08/2021,"lorem, vehicula et, rutrum eu, ultrices"
39,Nascetur Ridiculus Mus Institute,Schiltigheim,65,03/06/2020,17/01/2021,ac arcu. Nunc mauris. Morbi non sapien molestie orci
40,Vulputate Eu Corp.,Baidyabati,24,20/05/2020,21/11/2020,"magna. Nam ligula elit, pretium et, rutrum non, hendrerit"
41,Quam Associates,Cwmbran,94,28/02/2020,17/02/2021,"aliquam, enim nec tempus scelerisque, lorem ipsum sodales purus, in"
42,Accumsan Laoreet Ipsum Consulting,Helmsdale,69,17/02/2020,11/12/2020,libero. Integer in magna. Phasellus dolor
43,Magnis LLC,Istmina,13,30/08/2020,20/10/2021,non lorem vitae
44,Dictum Eu PC,Emden,47,09/06/2020,04/03/2021,Vivamus nisi. Mauris nulla. Integer urna. Vivamus molestie dapibus ligula.
45,Ullamcorper Incorporated,Kerikeri,43,09/02/2020,30/10/2021,Sed eu eros. Nam consequat dolor
46,Iaculis Odio Nam Inc.,Jambi,68,16/04/2020,10/12/2020,"orci, consectetuer euismod est"
47,Sit Amet Risus Corporation,Alajuelita,58,16/04/2020,19/06/2021,ante bibendum ullamcorper.
48,Tortor Nunc PC,Padre Hurtado,64,11/02/2020,09/06/2021,interdum enim non nisi. Aenean eget metus. In nec orci.
49,Tristique Neque Foundation,Landshut,99,18/09/2020,09/10/2021,"sociosqu ad litora torquent per conubia nostra,"
50,Luctus Associates,Cochrane,18,01/11/2020,29/08/2021,tellus lorem eu metus. In lorem.
51,Tempus Lorem Industries,Rzeszów,18,08/03/2020,17/09/2021,Aliquam vulputate ullamcorper magna. Sed eu eros. Nam consequat
52,Tellus LLC,Warburg,30,19/09/2020,14/08/2021,"Mauris vestibulum,"
53,Quam Quis Diam Associates,Kerkrade,85,21/04/2020,09/04/2021,Nullam nisl. Maecenas malesuada fringilla est. Mauris
54,Pede Foundation,Norman Wells,13,28/02/2020,13/03/2021,"tincidunt, nunc ac mattis ornare,"
55,Amet Consectetuer Foundation,Montacuto,13,01/11/2019,12/11/2020,est. Mauris eu turpis. Nulla aliquet.
56,Placerat Augue Sed Corp.,Holman,68,30/01/2020,10/08/2021,felis purus ac tellus. Suspendisse sed dolor.
57,Nullam Nisl Ltd,Telde,25,08/08/2020,23/06/2021,erat volutpat. Nulla dignissim. Maecenas ornare egestas ligula. Nullam
58,Nibh LLP,Southampton,16,29/11/2019,10/11/2021,"parturient montes, nascetur"
59,Nulla In PC,Athus,31,24/12/2019,30/09/2021,eu
60,Fusce Mollis LLP,Montignies-sur-Sambre,64,06/03/2020,01/12/2020,"lorem ipsum sodales purus, in molestie tortor nibh sit"
61,Tincidunt Adipiscing Inc.,Howrah,9,19/03/2020,03/01/2021,"luctus sit amet, faucibus"
62,Ante Blandit Company,Yaxley,68,01/11/2020,26/02/2021,"ullamcorper, nisl arcu iaculis enim,"
63,Et Ltd,Hatfield,90,09/01/2020,02/01/2021,"risus, at fringilla purus mauris a nunc. In"
64,Nam Nulla Limited,Kalken,63,10/01/2020,14/11/2021,"Donec est. Nunc ullamcorper, velit"
65,Tellus Justo Sit Ltd,Flint,53,05/09/2020,24/07/2021,"nulla ante,"
66,Odio Etiam Ligula Inc.,Wolvertem,77,25/05/2020,13/10/2021,volutpat. Nulla dignissim. Maecenas ornare egestas
67,Orci Incorporated,Ergani,84,20/04/2020,19/07/2021,In
68,Tincidunt Neque Inc.,New Glasgow,24,01/09/2020,18/10/2021,"tincidunt nibh. Phasellus nulla. Integer vulputate, risus a ultricies"
69,Convallis Est Incorporated,Telford,27,06/02/2020,27/06/2021,feugiat. Sed nec metus facilisis lorem tristique aliquet. Phasellus fermentum
70,Elit Pede Consulting,Tucapel,71,23/07/2020,10/07/2021,"dolor dapibus gravida. Aliquam tincidunt, nunc ac mattis ornare,"
71,Tortor At Corp.,Vico del Gargano,81,22/09/2020,24/02/2021,"odio a purus. Duis elementum, dui quis accumsan"
72,Pellentesque Tincidunt Company,Medemblik,100,12/09/2020,20/03/2021,"non, lacinia"
73,Torquent Per Conubia LLP,Cherepovets,30,26/07/2020,25/03/2021,Morbi quis urna. Nunc quis arcu vel quam
74,Et Associates,Yongin,93,14/08/2020,03/10/2021,"blandit enim consequat purus. Maecenas libero est, congue a, aliquet"
75,Quam LLC,Cefalà Diana,82,21/10/2020,20/08/2021,"eleifend egestas. Sed pharetra, felis eget varius"
76,Cum Sociis Industries,Cartagena del Chairá,60,11/03/2020,09/01/2021,Mauris quis turpis vitae
77,Id Libero Corporation,Armungia,80,15/01/2020,10/07/2021,blandit enim consequat purus. Maecenas libero
78,Turpis Non Corporation,Acciano,65,07/01/2020,25/08/2021,"est ac facilisis facilisis, magna tellus"
79,Phasellus Dapibus Quam LLC,Devizes,61,04/08/2020,26/08/2021,egestas. Aliquam
80,A PC,Camaçari,100,03/03/2020,10/04/2021,egestas. Aliquam fringilla cursus purus. Nullam scelerisque neque sed sem
81,Velit Pellentesque Ultricies Institute,Thuillies,19,22/06/2020,06/11/2021,"vel, vulputate"
82,Nec Leo Morbi Industries,San Fabián,33,07/03/2020,11/03/2021,"odio a purus. Duis elementum, dui quis accumsan"
83,At Associates,Lisieux,95,23/09/2020,16/07/2021,hymenaeos. Mauris ut quam vel sapien
84,Pede Ac Urna Associates,Marchtrenk,44,16/11/2019,14/11/2021,"sit amet, dapibus id, blandit at, nisi. Cum"
85,Dui Consulting,Plainevaux,19,09/07/2020,14/02/2021,"Suspendisse ac metus vitae velit egestas lacinia. Sed congue,"
86,Orci Quis Lectus Associates,Grangemouth,12,17/11/2019,30/06/2021,"erat nonummy ultricies ornare, elit elit"
87,Aliquet Sem Corp.,Murcia,19,27/02/2020,30/09/2021,"fermentum vel, mauris."
88,Dolor Corp.,Alix,43,29/02/2020,26/07/2021,"dis parturient montes, nascetur ridiculus mus."
89,Ac Eleifend Vitae LLP,Modakeke,21,24/10/2020,14/12/2020,"risus. Quisque libero lacus, varius et, euismod"
90,Tellus Faucibus Limited,Pitt Meadows,92,15/06/2020,20/02/2021,quam.
91,Diam Sed LLP,St. Johann in Tirol,22,26/09/2020,20/01/2021,semper cursus. Integer mollis. Integer tincidunt aliquam arcu. Aliquam ultrices
92,Auctor Nunc Nulla Foundation,Yuryuzan,16,12/02/2020,25/07/2021,"in, tempus eu, ligula."
93,Euismod Enim Foundation,Acquafredda,38,16/12/2019,03/10/2021,cursus
94,Eget Odio Aliquam LLP,Daska,6,20/09/2020,07/12/2020,nec
95,Lorem Sit Industries,Namur,83,28/04/2020,25/02/2021,"mauris, rhoncus id, mollis nec, cursus a, enim. Suspendisse"
96,Egestas Fusce Aliquet Associates,Caccamo,28,09/07/2020,29/06/2021,"posuere, enim nisl elementum purus, accumsan interdum libero dui nec"
97,Nibh Enim Company,Schepdaal,37,23/04/2020,19/05/2021,libero. Morbi accumsan laoreet ipsum. Curabitur
98,Malesuada Id Corporation,Gandhidham,59,23/03/2020,21/11/2021,volutpat.
99,Nunc Mauris PC,Sorbo Serpico,77,15/02/2020,13/05/2021,"vitae, posuere at, velit."
100,Vitae Sodales Corp.,Priero,55,11/04/2020,08/04/2021,"orci lacus vestibulum lorem, sit amet ultricies sem magna nec"